Catégorie,Nom du Produit,Prix
High-Tech,"Amazon Fire TV Stick HD (Nouvelle génération) | TV gratuite et en direct, télécommande vocale Alexa, contrôle de la maison connectée, streaming HD","44,99 €"
High-Tech,"Tapo 2K(3MP) Caméra Surveillance WiFi intérieure 360° C210, Vision nocturne, Notifications en temps réel, Détection de personne, Suivi de mouvement, Télécommande, Compatible avec Alexa","16,58 €"
High-Tech,"Aioneus Chargeur USB C, 40W 4 Port Prise USBC Chargeur Rapide iPhone, Multi Secteur PD+QC 3.1A Type C Adaptateur pour iPhone 16 15 14 13 12 11 Pro Max X XS XR 8 7 6S Plus Mini SE, iPad,Samsung Galaxy","9,99 €"
High-Tech,Apple AirTag,"30,07 €"
High-Tech,"INIU Batterie Externe, 22.5W 10000mAh Power Bank, Batterie Portable USB C Input & Output PD3.0 QC4.0 Charge Rapide Powerbank Compatible avec iPhone 16 15 14 13 12 Pro Max Plus Samsung iPad Pro etc","16,22 €"
High-Tech,Imou 2K(3MP) Caméra Surveillance WiFi Intérieure Caméra 360° Connectée Smartphone avec Détection Humaine AI Suivi Intelligent Sirène Audio Bidirectionnel Compatible Alexa pour Bébé/Animaux,"18,99 €"
High-Tech,Batterie Externe 20000mAh 22.5W PD3.0 QC4.0 Power Bank Batterie Portable USB C Input & Output Charge Rapide Powerbank avec écran LCD Compatible avec Smartphones smartwatches etc,"10,99 €"
High-Tech,"JBL GO 4, Enceinte Bluetooth ultra-portable, son JBL Pro, basses percutantes, 7 heures d'autonomie, fonction Playtime Boost, résistante à l'eau et à la poussière IP67, noir","37,44 €"
High-Tech,"Duracell Plus Piles AAA (lot de 12) - Alcalines 1,5V - Jusqu’à 100% plus longtemps - Idéales pour les appareils du quotidien - Emballage 0% plastique - Conservation 10 ans - LR03 MN2400","6,66 €"
High-Tech,"Chargeur for iPhone 14/14 Pro /14 Pro Max /14 Plus /13 12 11 SE Mini X XS XR, 25W USB C Prise Rapide et 2M Cable Secteur Mural Type C Alimentation Adaptateur Trefard","12,99 €"
High-Tech,Amazon Basics Lot de 40 piles alkaline AA industrielles,"10,80 €"
High-Tech,"Apple AirPods 4 Écouteurs sans Fil, Casques et écouteurs Bluetooth, Audio Spatial personnalisé, résistance à la Transpiration et l’Eau, boîtier de Charge USB-C, Puce H2, Jusqu’à 24 Heures d’autonomie","116,73 €"
High-Tech,"Duracell Plus Piles AA (lot de 12) - Alcalines 1,5V - Jusqu’à 100% plus longtemps - Idéales pour les appareils du quotidien - Emballage 0% plastique - Conservation 10 ans - LR6 MN1500","6,66 €"
High-Tech,"DURACELL CR2032 Piles Boutons au lithium 3V (lot de 4) - Jusqu’à +70 % de longévité - Technologie Sécurité Enfant - Recommandées pour l’AirTag d’Apple - Clés, appareils maison, sport et médicaux","5,53 €"
High-Tech,"Energizer Piles AAA, Alkaline Power, Lot de 16, Pile alcaline","9,16 €"
High-Tech,Apple EarPods avec connecteur Lightning ​​​​​​​,"16,82 €"
High-Tech,"VARTA Piles Bouton CR2032, lot de 5, Power on Demand, Lithium, 3V, emballage sécurisé pour les enfants, pour petits appareils électroniques - clés de voiture, télécommandes, balances","7,56 €"
High-Tech,Energizer Lithium Batteries 2032 - 6 pack,"5,04 €"
High-Tech,Apple Lot de 4 AirTags,"115,00 €"
High-Tech,"FNTCASE Coque pour iPhone 13 : iPhone 14 iPhone 16e - Protection magnétique Militaire Contre Les Chutes - Anti-jaunissement - Coque de Protection Robuste et Durable résistante aux Chocs - 6,1""","8,32 €"
High-Tech,"Lot de 2 pour Chargeur Rapide iPhone, 20W PD USB-C Prise Secteur avec 2m Câble USB C vers Lightning pour iPhone 14/14 pro/13/13 Pro/13 Pro Max/13 Min","14,99 €"
High-Tech,"DURACELL CR2032 Piles Boutons au lithium 3V (lot de 8) - Jusqu’à +70 % de longévité - Technologie Sécurité Enfant - Recommandées pour l’AirTag d’Apple - Clés, appareils maison, sport et médicaux","9,94 €"
High-Tech,"Nouvel Amazon Kindle Paperwhite (16 Go) | Notre modèle le plus rapide avec un nouvel écran antireflets de 7"" et une autonomie de plusieurs semaines | Sans publicités | Noir","179,99 €"
High-Tech,SAMSUNG Galaxy A05s 4GB+64GB [Version Internationale] (Noir),"99,97 €"
High-Tech,"Ecouteurs Bluetooth sans Fil,Bluetooth 5.3 Ecouteurs sans Fil,Ecouteurs Hi-FI Son Stéréo,Écouteurs 35H Durée de Lecture CVC Réduction de Bruit USB C Casque Bluetooth for iOS Galaxy Xiaomi Oppo Android","16,99 €"
High-Tech,"Power Bank 27000mAh 22.5W PD3.0 QC4.0 Batterie Externe Fast Charge Rapide Powerbank Portable avec écran LCD USB C Input & Output Chargeur Compatible avec Smartphone, tablettes","16,99 €"
High-Tech,"Apple AirPods Pro 2 Écouteurs sans Fil, Casques et écouteurs Bluetooth, Réduction Active du Bruit, Appareil auditif, Mode Transparence, Audio Spatial personnalisé, Son Haute-fidélité, Recharge USB-C","224,66 €"
High-Tech,"JBL TUNE 510BT – Casque supra-auriculaire sans fil – Equipé de la technologie Bluetooth – Connection multi-points – Léger, confortable et pliable – Jusqu’à 40 hrs d’écoute – Noir","28,29 €"
High-Tech,"Energizer Piles AA, Alkaline Power, Lot de 24, Pile alcaline","12,91 €"
High-Tech,"Adaptateur CarPlay sans fil pour Apple iPhone, adaptateur sans fil carplay avec câble d'extension USB & USB-C/Type-C, Compatible avec Les Voitures à partir de 2016 et Phone iOS 10+","29,99 €"
Livres,Intérieur nuit,"17,06 €"
Livres,Les secrets de la femme de ménage,"8,15 €"
Livres,La femme de ménage,"8,15 €"
Livres,KRAKEN: Système politique de l'ère numérique,"9,47 €"
Livres,L'heure des prédateurs,"18,01 €"
Livres,One Piece - Édition originale - Tome 109,"6,82 €"
Livres,La femme de ménage se marie,"4,64 €"
Livres,La femme de ménage voit tout,"20,85 €"
Livres,Hunger Games : Lever de soleil sur la moisson,"18,86 €"
Livres,Antigone,"6,16 €"
Livres,La Très Catastrophique Visite du Zoo,"18,01 €"
Livres,"Coloriages mystères Disney - Héros & Méchants, la battle","13,29 €"
Livres,Lakestone - tome 2,"18,96 €"
Livres,Votre santé optimisée: Le protocole quotidien qui va changer votre vie,"18,86 €"
Livres,Toutes les matières 3e - Ma Compil fiches Brevet - Brevet 2025,"11,36 €"
Livres,"La mort en face: Dr. Philippe Boxho, le médecin légiste qui fait parler les morts.","18,86 €"
Livres,L'art et la création de Arcane,"134,99 €"
Livres,Les #Gueux,"4,64 €"
Livres,H: Le nouveau thriller événement de Bernard Minier,"21,71 €"
Livres,Solo Leveling T17,"14,17 €"
Livres,La Fille au pair,"20,76 €"
Livres,"Les cinq blessures qui empêchent d'être soi-même: Rejet, abandon, humiliation, trahison, injustice","8,53 €"
Livres,On m'appelle Casquette verte,"18,96 €"
Livres,Devenir Brigitte,"28,34 €"
Livres,Avec le temps...,"18,86 €"
Livres,Mémoires d'un expert psychiatre,"8,44 €"
Livres,Les Piliers de la mer,"20,76 €"
Livres,Les ingénieurs du chaos,"8,06 €"
Livres,Les Quatre Accords toltèques: La voie de la liberté personnelle,"8,48 €"
Livres,"Bibliocollège - Le Médecin malgré lui, Molière","3,41 €"
Mode,Swarovski Boucles d'oreilles Creativity Circle,"13,75 €"
Mode,Swarovski Boucles d'oreilles Attract Trilogy,"77,00 €"
Mode,BOSS Hommes TShirtVN 3P Classic Lot de Trois t-Shirts en Jersey de Coton à col V,"22,46 €"
Mode,PUMA Mixte Smash V2 L Baskets,"28,90 €"
Mode,"EASTPAK Padded PAK'R Sac à Dos, 24 L - Black (Noir)","32,08 €"
Mode,ANTONIO ROSSI (lot de 12) boxers ajustés pour hommes - Boxers pour hommes avec ceinture élastique,"32,99 €"
Mode,"Akusoli Semelles | Semelles Chaussures Confort, Semelles de Soutien Voûte, Semelles Pieds Plats, Douleur au Pied, Semelle Homme, Femmes EU36-42","24,99 €"
Mode,"VSUDO Lacets Chaussures Plats pour Baskets, Lacets Plats pour Sneakers - Économiques, 8mm de Large, 29 Couleurs 14 Longueurs au Choix","5,16 €"
Mode,Dim Boxer (Lot de 6) Femme,"10,75 €"
Mode,Crocs Mixte Enfant Classic Clog K-Unisex Kids Sabot,"29,99 €"
Mode,Calvin Klein Trunk (Lot de 3) Homme,"44,90 €"
Mode,"Cabin Max Anode Valise Cabine 55x35x25 Bagage à Main, Trolley léger à Coque Dure, Serrure intégrée - Air France, KLM, ITA, Transavia -44L","54,12 €"
Mode,"SINOPHANT Legging Femmes Pantalon de Sport, Jegging Taille Haute Femme Yoga Opaque Doux Grande Taille","9,99 €"
Mode,PUMA Mixte Popcat 20 Slide Sandal,"14,00 €"
Mode,adidas Mixte Adilette Aqua Slides TOBOGGANS,"13,33 €"
Mode,Crocs Classic Clog T Sabots Mixte Enfant,"17,63 €"
Mode,KLOSTAIN Baggage Cabine 40x20x25 pour Ryanair Sac à Dos Voyage Cabine Avion 20 L Femme Homme Bagage à Main Sac à Dos pour Ordinateur Portable Noir,"30,82 €"
Mode,QINCAO Boxers Homme Lot de 6 Coton Pas d'étiquette Qui Gratte sous-vêtement Fitted Trunk Caleçons Ultra Doux Confortale,"20,82 €"
Mode,"SOXCO chaussettes de travail homme 10 Paires, WORK socks lot de 10 paires","16,66 €"
Mode,FM London Lot de 3/5 t-Shirts pour Hommes - T-Shirts de qualité supérieure avec Design légèrement ajusté,"21,16 €"
Mode,"Olukssck 2 Paires Élastiques Lacets Plats avec Fermeture en Métal, Élastiques sans Nœuds Cravate Lacets pour Enfants et Adultes, Lacets de Sport de Chaussures pour Toutes Les Chaussures","5,82 €"
Mode,"Blendura Pese Bagages de Voyage Pese Numérique pour Bagages, Balance Portable Pese Valise de Voyage, Balance Valise Tare Fonction, Balance Bagage MAX 50 kg/ 110lb pour Voyage","5,49 €"
Mode,Feethit Baskets et Chaussures de Sport Homme Tennis Respirant Légères et Confortables de la Mode de Marche Fitness Running Tennis Outdoor Gym Jogging Sneakers Hommes,"23,74 €"
Mode,PUMA Mixte Smash v2 Baskets,"24,58 €"
Mode,Dim Soutien-Gorge Femme avec Armatures Generous Classique x1,"23,29 €"
Mode,FM London Chaussettes lot de 10 pour hommes,"9,16 €"
Mode,"YouShow 10 Paires Chaussettes Basses Homme Femme, Coton Courtes Chaussettes Basses, Sport Respirant Antiderapante Socquettes","14,99 €"
Mode,"Levi's June L S, Tongs femme","29,00 €"
Mode,Levi's 511 Slim Jeans Homme,"50,00 €"
Mode,Roxy Femme Viva Sandale,"4,99 €"
Maison & Cuisine,"De'Longhi EcoDecalk Détartrant DLSC500, 5 Doses de Décalcification, Accessoire de Maintenance pour Machine à Café, Ingrédients à Base de Plantes, Bouteille Avec 5 Doses, 500ml","9,90 €"
Maison & Cuisine,"Amazon Basics Drap Housse, 160 x 200 x 30 cm, en Polyester Microfibre pour Matelas Épais jusqu'à 30 cm, Bleu Marine","9,30 €"
Maison & Cuisine,"De'Longhi Cartouche Filtrante DLSC002, Filtre a Eau Machine a Café, Blanc","6,09 €"
Maison & Cuisine,Philips GC026/80 Rasoir Anti-Bouloche et Anti-Peluche - Noir et Or,"8,32 €"
Maison & Cuisine,"Amazon Basics housses de rangement sous vide avec pompe manuelle, Fermeture éclair, 5 pièces, Taille L, Clair","10,53 €"
Maison & Cuisine,"Utopia Bedding Protège Matelas 160 x 200 x 30 cm Imperméable, Certifié Oeko TEX, Alèse Drap Housse, Matelas Couvre, Respirant, Élastique Tout Autour","15,82 €"
Maison & Cuisine,"BISSELL Formule Spot et Stain | Pour vos Étoffes d’Ameublement, Tapis et Moquette | 1 Litre Formule Nettoyante | À Utiliser Avec Spotclean/Spotclean Pro | Parfum Frais | 1084N","26,89 €"
Maison & Cuisine,"douceur d'intérieur, Drap Housse (140 x 190 cm) Lina Gris Souris, 100% Coton","8,08 €"
Maison & Cuisine,Protege Matelas 160x200 cm Imperméable Oeko TEX par Dreamzie - Alese 160x200 en Coton Respirant avec 4 Coins Elastiques,"18,99 €"
Maison & Cuisine,"Rowenta Lot de 4 sacs Hygiène+, Compatibles avec les aspirateurs traineau Compact Power, Power XXL, Silence Force, X-Trem Power ZR200520 Blanc","6,67 €"
Maison & Cuisine,Utopia Bedding Housse de Couette 220x240 cm avec 2 Taies d'oreiller 65x65 cm (Gris) - Parure de lit 220 x 240 cm - Ensembles de Housses de Couette en Microfibre brossée Douce,"20,82 €"
Maison & Cuisine,Spontex Microfibre Collection - Microfibres Multi-usages - 8 Chiffons de Nettoyage en Microfibre,"3,32 €"
Maison & Cuisine,"Loctite Super Glue-3 Power Gel Mini Dose, colle forte enrichie en caoutchouc, mini-dose de colle gel ultra-résistante, séchage immédiat, colle transparente, lot de 3 tubes 1 g","5,22 €"
Maison & Cuisine,"4 bougies d'ambiance "" fontaine d'artifice"" pour gâteau d'anniversaire, durée 60 secondes, Sans Parfum","5,59 €"
Maison & Cuisine,"TODAY Essential - Drap Housse 90X190 cm 1 Personne 100% Coton Uni, Celadon","7,32 €"
Maison & Cuisine,"POWSAF Mousseur à Lait, Fouet Électrique avec Support, Emulsionneur à Lait, 13000 Tr/min, Fouet Mini Mixeur pour Café, Latte, Cappuccino, Matcha, Noir","4,95 €"
Maison & Cuisine,"Kärcher Nettoyant vitres concentré RM 503 , pour un nettoyage sans traces des fenêtres, miroirs et cabines de douche, 500ml donnent 6,25l de liquide de nettoyage dilué, Jaune","7,00 €"
Maison & Cuisine,"Tefal Ice Force Couteau à éplucher 9 cm, Couteau de cuisine, Lame en acier inoxydable allemand, Coupe performante, Tranchant longue durée, Garantie 10 ans K2320514","5,82 €"
Maison & Cuisine,Philips Filtre à Eau Anti-Calcaire AquaClean pour Machine Expresso - Pour un Café de Qualité et un Arôme Intense - Lot de 2 (CA6903/22),"16,99 €"
Maison & Cuisine,"Tineco iFLOOR 5 Breeze Complete Nettoyeur de Sol, Aspirateur Sec Humide sans Fil, Nettoyage en Un Seul Passage des sols durs, Nettoyage dans Les Angles, Auto-Nettoyage Automatique, Conception légère","191,04 €"
Maison & Cuisine,EQM - ECO-212 - Détartrant pour machine à café - 1L - 100% d'origine naturelle - Compatible avec toutes les machines à café,"5,50 €"
Maison & Cuisine,"BRITA Cartouche Filtre eau robinet MAXTRA PRO All-In-1 Pack de 12 |Goûtez à une eau plus pure¹ avec la recharge originale pour carafes BRITA-réduit² micro-impuretés comme certains PFAS, chlore, tartre","53,33 €"
Maison & Cuisine,"GRIFEMA GA2002 Balance de Cuisine Électronique de Haute Précision 5000g/1g avec Écran LCD Rétroéclairé, 6 Unités et Fonction Tare Acier Inoxydable, Smart Digital, pour Alimentaire Multifonctionnel","7,42 €"
Maison & Cuisine,Dreamzie - Protege Matelas 140x190 cm - Imperméable et Résistant - Alese 140x190 cm - Protection Optimale et Respirante,"16,66 €"
Maison & Cuisine,"Kärcher Nettoyeur de Vitres WV 2 Black Edition, Autonomie de Batterie : 35 min, Affichage LED, 2 Raclettes, Pulvérisateur avec Microfibres, 20 ml Nettoyant Vitres Concentré","52,12 €"
Maison & Cuisine,"HOMIDEC Etendoir Linge, 4 Niveaux Grande Sechoir a Linge Pliable avec Roues, Acier Inoxydable Seche Linge Etendoir pour Intérieur et Extérieur, Gris","35,99 €"
Maison & Cuisine,SWEET NIGHT - Protège Matelas 140x190 cm | Alèse Imperméable et Micro Respirante | Souple et Silencieux | Lavable à 90°C,"15,82 €"
Maison & Cuisine,"PRADEL ESSENTIEL - 12 cuillères à café - Baltics - Acier inoxydable 18/0, Finition Standard - Longueur 136 mm","2,49 €"
Maison & Cuisine,Sac Sous Vide Vetement Aspirateur 5 Pièces 3XL 100X80cm 2L 80x60cm Housse de Rangement Réutilisable Couette Stockez Vêtements la Literie et les Bagages,"13,29 €"
Maison & Cuisine,"Dreamzie Taie Oreiller 50x70 Lot de 2 en Microfibre Certifiée Oeko-Tex - Housse Coussin Douce Et Brossée, Toucher Peau de Pêche - Blanc","8,32 €"
Jeux et Jouets,LEGO Speed Champions Voiture F1 Ferrari SF-24 - Jeu de Construction avec véhicule de Course - Inclut minifigurine Collector de Pilote de Formule 1 - Idée Cadeau pour garçon ou Fille 77242,"20,82 €"
Jeux et Jouets,"SKYJO, de Magilano - Le Tout Nouveau Jeu de Cartes/de société pour Les Petits et Les Grands pour se divertir et Passer des soirées Amusantes avec des Amis et en Famille","13,29 €"
Jeux et Jouets,ATM Gaming Speedbac - Jeu de société Famille et Amis - Parfait pour Mettre l'ambiance - 2 à 7 Joueurs - Grand Prix du Jouet 2024,"14,85 €"
Jeux et Jouets,"Play-Doh, 20 Pots de Pâte à Modeler avec des Couleurs Différentes, Jeu Éducatif pour Filles et Garçons dès 2 ans, Cadeau pour Anniversaire, Activité Créative","10,98 €"
Jeux et Jouets,"20 Cartes Officielles Pokémon Françaises Dont 5 Brillantes, 0 Doublon et 0 Energie - Cartes Pokemon Ideal comme Cadeau Enfants et Adultes","8,31 €"
Jeux et Jouets,Rubik's Cube - Rubiks Cube 3x3 - Jeu Casse-Tête Adulte Et Enfant - Puzzle Original Correspondance Couleurs - Puzzle Résolution de Problème - Jeu Enfant 8 Ans Et +,"9,99 €"
Jeux et Jouets,Bundle Magic: The Gathering Tarkir : la tempête des Dragons (Version Française),"37,49 €"
Jeux et Jouets,"Beyblade X Set de Combat Xtreme, Jouet pour Garçons et Filles dès 8 Ans, Toupie Détachable pour la Compétition à Collectionner","24,58 €"
Jeux et Jouets,"Cartes éducatives,Flash Jouets éducatifs pour Jeunes Enfants de 1 à 6 Ans, Jouets préscolaires pour écouter et Apprendre 224 Mots (Bleu français)","13,32 €"
Jeux et Jouets,"RUBIE'S Marvel Officiel - Déguisement Enfant Spider-Man Classique - Tailles 3 à 10 ans au Choix - Costume Complet Combinaison avec Masque et Couvre-Chaussures. Pour Carnaval, Halloween, Anniversaire","18,68 €"
Jeux et Jouets,"Lansay - BLOPENS - Set Activités Féeriques - Feutres de Coloriage À Souffler Avec Pochoirs Réutilisables - Idée Cadeau Enfants dès 5 Ans - Kit Création Dessins Fées, Licornes & Sirènes Pailletées","8,32 €"
Jeux et Jouets,Smoby - Sonnette Electronique - Accessoire de Maison Smoby - Plein Air - Dès 2 Ans - Gris - 810917,"5,82 €"
Jeux et Jouets,"LEGO Technic Le Buggy Tout-Terrain de Course, Véhicule de Rallye, Jouet de Construction de Voiture de Course, Cadeau pour Garçons et Filles Dès 8 Ans 42164","16,31 €"
Jeux et Jouets,Asmodee - TRIO - Jeu de Cartes Made in France - Récompensé As d'Or 2024 - Jeux de Société pour Famille et Enfants dès 7 Ans - 3 à 6 Joueurs - 15 Min - Version française - Cocktail Games,"9,16 €"
Jeux et Jouets,Paw Patrol - Pat Patrouille - Véhicule Figurine Ryder - Voiture Figurine À Collectionner - Pat Patrouille Jouet - Plastique Recyclé - Voiture Enfant - Jouet Enfant 3 Ans Et +,"12,49 €"
Jeux et Jouets,"BIC Kids Kid Couleur - Feutres de Coloriage Lavables à Pointe Moyenne - Couleurs Assorties, Etui Carton de 36","5,32 €"
Jeux et Jouets,"Bandai - Tamagotchi - Tamagotchi Original - Berry Delicious - Animal électronique virtuel avec écran Couleur, 3 Boutons et Jeux - Jouet Animal interactif en Français - Jouet Enfant 8 Ans et + - 42971","12,79 €"
Jeux et Jouets,ATM Gaming Speedbac Kids - Jeu de société Enfants - Parfait pour Mettre l'ambiance en Famille - 2 à 7 Joueurs - Grand Prix du Jouet 2024 - A Partir de 7 Ans,"15,82 €"
Jeux et Jouets,"Unicorn Academy - L'Ecole des Licornes - Licorne Wildstar + Poupée Sophia - Licorne, Poupée Et Accessoires À Collectionner - Jouets Inspirés De La Série L'Ecole des Licornes - Jouet Enfant 4 Ans et +","12,87 €"
Jeux et Jouets,"LEGO Speed Champions La Voiture de Course de Formule 1 McLaren 2023, Véhicule Jouet pour Enfants dès 9 Ans Qui Aiment Le Jeu en Autonomie, Set de Construction, Décoration Chambre, Idée Cadeau 76919","22,29 €"
Jeux et Jouets,"ROXENDA Cube de Vitesse 3X3 Speed Cube, Stickerless Cube Magique Facile à Tourner et à Lisser Speedcube- Tourne Plus Vite Que l'original (3x3x3)","7,49 €"
Jeux et Jouets,"CRACK LIST - Jeu du Petit bac - Jeu de Cartes - Jeu d'ambiance - entre amis et en famille - 10 ans et plus - 2 à 8 joueurs - version française - Yaqua Studio, YAQ001CR, Bleu","15,79 €"
Jeux et Jouets,"JCC Pokémon : Mini-boîte Magnifique Paldea – Superdofin et Pachirisu (2 boosters, 1 Page d’Autocollants)","9,99 €"
Jeux et Jouets,"Kinderkraft Aveo Tricycle Bébé Évolutif, Draisienne Évolutif, Trike Bebe, Velo Poussette Bebe Évolutif, Velo Enfant 5 Ans, De 9 Mois, Pliable, Facile À Plier, Accessoires Pratiques, Gris","90,83 €"
Jeux et Jouets,"Mattel Games UNO Classique, Jeu De Cartes Familial pour Enfants Et Adultes, Jeu De Société pour Soirée Jeux en Famille Ou en Voyage, 2 À 10 Joueurs, Jouet pour Enfant de 7 Ans et Plus, W2087","6,79 €"
Jeux et Jouets,"BURAGO - Ferrari 296 GTB R&P - Modèle réduit réaliste à l'échelle 1:43, Licence Officielle Ferrari, âge recommandé : 3 Ans et Plus","5,82 €"
Jeux et Jouets,LEGO Minecraft La Maison De Porcelet - Pâques Loisirs Créatifs - Jeu De Construction Filles Dès 7 Ans Passionnées du Jeu Vidéo - Piglin Zombifié dans Biome De La Forêt - Cadeau d'anniversaire 21268,"12,45 €"
Jeux et Jouets,"100PCS Pochette Carte, 0.1MM Transparentes Protège Carte Pour Cartes Pokémon, Cartes de Change, Yu-Gi-Oh, Magic(66 x 92 MM)","4,16 €"
Jeux et Jouets,Maped - 24 Feutres Pixel Party - Feutre de coloriage - Feutre de Couleur pour Dessin enfants - Feutre lavable avec Pointe Moyenne Bloquée,"3,67 €"
Jeux et Jouets,"Beyblade X, Starter Pack Scythe Incendio 4-60T avec Toupie de Compétition et Lanceur, Jouets pour Enfants à Partir de 8 Ans, pour Garçons et Filles","6,92 €"
